{
  "schema_version": "1.0",
  "plan_id": "plan-example-003",
  "task_id": "task-example-001",
  "objective": "Blocked objective",
  "assumptions": [],
  "completion_criteria": [
    "Blocked"
  ],
  "steps": [
    {
      "step_id": "step-001",
      "title": "Read",
      "description": "Read",
      "step_type": "tool",
      "tool_name": "read_approved_file",
      "parameters": {
        "path": "approved/input.txt"
      },
      "depends_on": [],
      "expected_output": "Success",
      "approval_hint": "none"
    }
  ],
  "final_output": {
    "type": "artifact",
    "format": "markdown"
  }
}